;год;;;;;;;wikipedia
187;;2704;День российского парламентаризма;ru;3;27 апреля;0;День_российского_парламентаризма
188;;2804;Всемирный день охраны труда;ru;1;28 апреля;0;Всемирный_день_охраны_труда
189;;2804;Скончался великий русский полководец М.И.Кутузов;ru;2;28 апреля;0;Кутузов,_Михаил_Илларионович
190;;2904;Международный день танца;ru;1;29 апреля;0;Международный_день_танца
191;;3004;День Пожарной Охраны;ru;3;30 апреля;0;День_пожарной_охраны_России
192;;3004;Вальпургиева ночь(Ночь ведьм);ru;2;30 апреля;0;Вальпургиева_ночь
193;;3004;Скончался Адольф Гитлер;ru;1;30 апреля;0;Гитлер,_Адольф
194;;105;Праздник Весны и Труда (День Труда);ru;1;1 мая;0;Первое_мая_(праздник)
195;;205;День рождения английского писателя Джером К. Джерома;ru;1;2 мая;0;Джером,_Джером_Клапка
196;;305;Всемирный день солнца;ru;1;3 мая;0;Всемирный_день_свободы_печати
197;;305;Деь молчания;ru;2;3 мая;0;День_молчания
198;;405;День рождения актрисы Одри Хепберн;ru;2;4 мая;0;Хепбёрн,_Одри
199;;405;"День ""Звездных войн""";ru;1;4 мая;0;День_Звёздных_войн
200;;505;Международный день борьбы за права инвалидов;ru;1;5 мая;0;Международный_день_борьбы_за_права_инвалидов
201;;505;Международный день акушерки;ru;2;5 мая;0;Международный_день_акушерки
202;;505;День водолаза в России;ru;1;5 мая;0;День_Водолаза
203;;505;День шифровальщика в России;ru;2;5 мая;0;День_шифровальщика
204;;605;День рождения психолога Зигмунда Фрейда;ru;1;6 мая;0;Фрейд,_Зигмунд
205;;605;Скончалась итальянский педагог Мария Монтессори;ru;2;6 мая;0;Монтессори,_Мария
206;;705;День Радио;ru;1;7 мая;0;День_радио
207;;705;День рождение композитора П.И.Чайковского;ru;2;7 мая;0;Чайковский,_Пётр_Ильич
208;;705;День работников уголовно-исполнительных инспекций ФСИН ;ru;3;7 мая;0;Федеральная_служба_исполнения_наказаний
209;;805;Скончался живописец Поль Гоген;ru;2;8 мая;0;Гоген,_Поль
210;;805;День рождения кинорежисера Валерия Тодоровского;ru;1;8 мая;0;Тодоровский,_Валерий_Петрович
211;;905;День Победы;ru;1;9 мая;16731919;День_Победы
212;;905;День рождения певца и поэта Б.Окуджавы;ru;2;9 мая;0;Окуджава,_Булат_Шалвович
213;;1005;Скончался русский писатель М. Е. Салтыков-Щедрин;ru;1;10 мая;0;Салтыков-Щедрин,_Михаил_Евграфович
214;;1105;День рождения художника  Сальвадора Дали;ru;1;11 мая;0;Дали,_Сальвадор
215;;1105;Скончался регги-музыкант Боб Марли;ru;2;11 мая;0;Марли,_Боб
216;;1205;Международный день медицинской сестры;ru;1;12 мая;0;Международный_день_медицинской_сестры
217;;1305;День Черноморского флота ВМФ России;ru;1;13 мая;0;Черноморский_флот_ВМФ_России
218;;1305;День конвоира;ru;2;13 мая;0;День_охранно-конвойной_службы
219;;1405;День рождения Марка Цукенберга;ru;1;14 мая;0;Цукерберг,_Марк
220;;1505;День отказника от военной службы;ru;1;15 мая;0;Международный_день_отказника_от_военной_службы_по_убеждениям_совести
221;;1605;День калмыцкого чая;ru;1;16 мая;0;День_калмыцкого_чая
222;;1605;Скончался писатель Шарль Перро;ru;2;16 мая;0;Перро,_Шарль
223;;1705;Всемирный день электросвязи и информационного общества;ru;2;17 мая;0;Всемирный_день_электросвязи_и_информационного_общества
224;;1705;Международный день борьбы с гомофобией;ru;1;17 мая;0;Международный_день_борьбы_с_гомофобией
225;;1805;Международный день музеев;ru;2;18 мая;0;Международный_день_музеев
226;;1805;День рождения философа Омар Хайяма;ru;1;18 мая;0;Омар_Хайям
227;;1805;День Балтийского флота ВМФ России;ru;1;18 мая;0;Балтийский_флот_ВМФ_России
228;;1905;День рождения телеведущей Леры Кудрявцевой;ru;1;19 мая;0;Кудрявцева,_Валерия_Львовна
229;;2005;Всемирный день метрологии;ru;3;20 мая;0;Всемирный_день_метрологии
230;;2005;День рождения советского авиаконструктора А.А. Туполева;ru;2;20 мая;0;Туполев,_Алексей_Андреевич
231;;2005;День рождения писателя Бориса Акунина;ru;1;20 мая;0;Борис_Акунин
232;;2105;День полярника;ru;1;21 мая;0;День_полярника
233;;2205;Международный день биологического разнообразия;ru;3;22 мая;0;Международный_день_биологического_разнообразия
234;;2205;День рождения английского писателя Артура Конан Дойля;ru;1;22 мая;0;Дойл,_Артур_Конан
235;;2205;Скончался писатель Виктор Гюго;ru;2;22 мая;0;Гюго,_Виктор
236;;2305;День рождения шахматиста А. Карпова;ru;1;23 мая;0;Карпов,_Анатолий_Евгеньевич
237;;2405;День славянской письменности;ru;1;24 мая;0;День_славянской_письменности_и_культуры
238;;2405;День кадрового работника;ru;2;24 мая;0;День_кадрового_работника
239;;2405;День Кирилла и Мефодия;ru;3;24 мая;0;Кирилл_и_Мефодий
240;;2505;День филолога;ru;2;25 мая;0;День_филолога
241;;2505;Праздник школьников - Последний звонок;ru;1;25 мая;0;Последний_звонок
242;;2505;День детей пропавших без вести;ru;3;25 мая;0;Пропавший_без_вести
243;;2605;День российского предпринимательства;ru;1;26 мая;0;День_российского_предпринимательства
244;;2705;Всероссийский День Библиотек;ru;1;27 мая;0;Общероссийский_день_библиотек
245;;2705;День города Санк-Петербурга;ru;1;27 мая;0;Санкт-Петербург
246;;2805;День Пограничника;ru;1;28 мая;0;День_пограничника
247;;2905;День военного автомобилиста;ru;1;29 мая;0;День_военного_автомобилиста
248;;2905;День ветеранов таможенной службы;ru;1;29 мая;0;День_ветеранов_таможенной_службы
249;;3005;День рождения русского полководца А.Невского;ru;2;30 мая;0;Александр_Ярославич_Невский
250;;3005;Скончалась Жанна д’Арк;ru;1;30 мая;0;Жанна_д’Арк
251;;3105;Всемирный день без табака;ru;1;31 мая;0;Всемирный_день_без_табака
252;;3105;День российской адвокатуры;ru;2;31 мая;0;День_российской_адвокатуры
253;;106;Международный день защиты детей;ru;1;1 июня ;0;Международный_день_защиты_детей
254;;106;День Северного флота ВМФ России;ru;2;1 июня ;0;Северный_флот_ВМФ_России
255;;306;День рождения российского нейрохирурга Н.Н. Бурденко;ru;1;3 июня;0;Бурденко,_Николай_Нилович
256;;406;Международный день невинных детей — жертв агрессии;ru;1;4 июня;0;Международный_день_невинных_детей_—_жертв_агрессии
257;;406;День рождения российского хоккеиста и тренера В.В.Тихонова;ru;2;4 июня;0;Тихонов,_Виктор_Васильевич
258;;406;День рождения актрисы Анджелины Джоли;ru;3;4 июня;0;Джоли,_Анджелина
259;;506;Всемирный день окружающей среды;ru;1;5 июня;0;Всемирный_день_окружающей_среды
260;;506;День эколога;ru;2;5 июня;0;День_эколога
261;1910;506;Скончался американский писатель О.Генри;ru;3;5 июня;0;О._Генри
262;2012;506;Скончался писатель Рей Брэдбери;ru;4;5 июня;0;Брэдбери,_Рэй
263;;606;Пушкинский День России/День русского языка;ru;1;6 июня;0;День_русского_языка
264;;606;День рождения А.С. Пушкина;ru;2;6 июня;0;Пушкин,_Александр_Сергеевич
265;;706;Международный день очистки водоемов;ru;1;7 июня;0;Международный_день_очистки_водоёмов
266;;806;День Социального Работника;ru;1;8 июня;0;День_социального_работника_(Россия)
267;;806;Всемирный день океанов;ru;2;8 июня;0;Всемирный_день_океанов
268;;806;День рождения первого доллорового миллиардера Д. Рокфеллера;ru;3;8 июня;0;Рокфеллер,_Джон_Дэвисон
269;;806;Скончался психолог А. Маслоу;ru;4;8 июня;0;Маслоу,_Абрахам_Харольд
270;;906;Международный день аккредитации;ru;1;9 июня;0;Международный_день_аккредитации
271;;906;День рождения императора Петра Великого;ru;2;9 июня;0;Пётр_I
272;;906;День рождения актера Джони Деппа;ru;3;9 июня;0;Депп,_Джонни
273;;1006;День рождения певицы Л. Зыкиной;ru;1;10 июня;0;Зыкина,_Людмила_Георгиевна
274;;1106;День рождения океанолога Жак-Ив Кусто;ru;1;11 июня;0;Кусто,_Жак-Ив
275;;1206;День России;ru;1;12 июня;0;День_России
276;;1206;День Работников Легкой Промышленности;ru;2;12 июня;0;Лёгкая_промышленность_России
277;;1306;День пивовара в России;ru;1;13 июня;0;Пиво_в_России
278;;1406;Всемирный день донора крови;ru;1;14 июня ;0;Всемирный_день_донора_крови
279;;1406;День работников миграционной службы;ru;2;14 июня ;0;День_работников_миграционной_службы
280;1946;1506;День рождения греческого певца Демиса Руссоса;ru;1;15 июня;0;Руссос,_Демис
281;1963;1606;Полет первой женщины космонавта В.В. Терешковой;ru;1;16 июня;0;Терешкова,_Валентина_Владимировна
282;;1706;Всемирный день борьбы с засухой;ru;1;17 июня;0;Всемирный_день_борьбы_с_опустыниванием_и_засухой
283;;1806;День рождения певца Пола Маккартни;ru;1;18 июня;0;Маккартни,_Пол
284;1985;1906;Скончалась советская певица М.В. Кристалинская;ru;1;19 июня;0;Кристалинская,_Майя_Владимировна
285;;2006;Всемирный день защиты слонов;ru;1;20 июня;0;Всемирный_день_защиты_слонов_в_зоопарках
286;;2106;День рождения Виктора Цоя;ru;1;21 июня;0;Цой,_Виктор_Робертович
287;;2106;Международный день скейтбординга;ru;3;21 июня;0;Международный_день_скейтбординга
288;;2106;День летнего солнцестояния;ru;2;21 июня;0;Равноденствие
289;;2106;День медицинского работника;ru;4;21 июня;0;День_медицинского_работника
290;;2206;День Памяти И Скорби;ru;1;22 июня;0;День_памяти_и_скорби
291;1941;2206;День начала Великой Отечественной войны;ru;2;22 июня;0;Великая_Отечественная_война
292;;2206;День рождения Мерил Стрип;ru;3;22 июня;0;Стрип,_Мерил
293;;2306;Международный Олимпийский день;ru;1;23 июня;0;Международный_Олимпийский_день
294;;2306;Государственный день ООН;ru;2;23 июня;0;День_государственной_службы_Организации_Объединённых_Наций
295;;2306;День рождения Валерия Меладзе;ru;3;23 июня;0;Меладзе,_Валерий_Шотаевич
296;;2406;День Парада Победы;ru;1;24 июня;0;Парад_Победы
297;;2406;Последний концерт Виктора Цоя;ru;2;24 июня;0;Цой,_Виктор_Робертович
298;2009;2506;Скончался Майкл Джексон;ru;1;25 июня;0;Джексон,_Майкл
299;;2506;Скончался океанолог Жак-Ив Кусто;ru;2;25 июня;0;Кусто,_Жак-Ив
300;;2606;День борьбы с наркотиками;ru;1;26 июня;0;Международный_день_борьбы_со_злоупотреблением_наркотическими_средствами_и_их_незаконным_оборотом
301;;2706;День Изобретателя И Рационализатора;ru;1;27 июня;0;День_изобретателя_и_рационализатора_(Россия)
302;;2706;День Молодежи России;ru;2;27 июня;0;День_молодёжи_(Россия)
303;;2806;День рождения гимнастки Ляйсан Утяшевой;ru;1;28 июня;0;Утяшева,_Ляйсан_Альбертовна
304;;2906;День партизан и подпольщиков;ru;1;29 июня;0;День_партизан_и_подпольщиков
305;1894;3006;Открыт лондонский мост Тауэр-Бридж;ru;1;30 июня;;Тауэрский_мост
306;1908;3006;Падение Тунгусского метеорита;ru;2;30 июня;0;Тунгусский_метеорит
307;1961;107;День рождения Принцессы Дианы;ru;1;1 июля;0;Диана,_принцесса_Уэльская
308;2009;107;Скончалась российская певица Л. Зыкина;ru;2;1 июля;0;Зыкина,_Людмила_Георгиевна
309;;207;Международный день спортивного журналиста;ru;1;2 июля;0;Международный_день_спортивного_журналиста
310;;207;День  рождения модельера Пьера Кардена;ru;2;2 июля;0;Карден,_Пьер
311;;307;День Государственной Автомобильной Инспекции Гаи (День ГИБДД);ru;1;3 июля;0;День_ГАИ_(ГИБДД)
312;;307;День рождения Тома Круза;ru;2;3 июля;0;Круз,_Том
313;;407;Международный день Днепра;ru;1;4 июля;0;Международный_день_Днепра
314;1986;507;Первые игры доброй воли в Москве;ru;1;5 июля;0;Игры_доброй_воли
315;;607;Всемирный день поцелую;ru;1;6 июля;0;Всемирный_день_поцелуя
316;;707;Иван Купала;ru;1;7 июля;0;Иван_Купала
317;1770;707;День воинской славый - Чесменское сражение;ru;2;7 июля;0;Чесменское_сражение
318;1962;707;День рождения певицы Ж. Агузаровой;ru;3;7 июля;0;Агузарова,_Жанна_Хасановна
319;1929;707;День рождения нейрофизиолога Н.П. Бехтеревой;ru;4;7 июля;0;Бехтерева,_Наталья_Петровна
320;;807;День семьи, любви и верности;ru;1;8 июля;0;День_Петра_и_Февронии
321;;807;День рождения физика П.Л. Капица;ru;2;8 июля;0;Капица,_Пётр_Леонидович
322;1877;907;Первый тенисный турнир в Уимблдоне;ru;1;9 июля;0;Уимблдон
323;1956;907;День рождения актера Тома Хенкса;ru;2;9 июля;0;Хэнкс,_Том
324;1709;1007;День воинской славый - Полтавская битва;ru;1;10 июля;0;Полтавская_битва
325;1947;1007;"День рождения И. Олейникова- ""Городок""";ru;2;10 июля;0;Олейников,_Илья_Львович
326;1957;1007;"День рождения Ю. Стоянов- ""Городок""";ru;3;10 июля;0;Стоянов,_Юрий_Николаевич
327;;1107;Всемирный день шоколада;ru;1;11 июля;0;Всемирный_день_шоколада
328;;1207;День Российской Почты;ru;1;12 июля;0;День_российской_почты
329;;1207;День фотографа;ru;2;12 июля;0;Святая_Вероника
330;;1207;День рыбака;ru;3;12 июля;0;День_рыбака
331;;1307;Открытие надписи HOLLY WOOD;ru;1;13 июля;0;Знак_Голливуда
332;;1407;День рождения певицы Пелагеи;ru;1;14 июля;0;Пелагея_(певица)
333;;1507;Скончался модельер Джанни Версаче;ru;1;15 июля;0;Версаче,_Джанни
334;;1607;День рождения Григория Лепса;ru;1;16 июля;0;Лепс,_Григорий_Викторович
335;;1707;День военно-морской авиации;ru;1;17 июля;0;Авиация_Военно-Морского_Флота_Российской_Федерации
336;;1707;День этнографа;ru;2;17 июля;0;День_этнографа
337;;1807;День хозяйственной службы органов внутренних дел России;ru;1;18 июля;0;День_хозяйственной_службы_органов_внутренних_дел_Российской_Федерации
338;;1907;День металлурга;ru;1;19 июля;0;День_металлурга
339;;1907;День юридической службы Министерства внутренних дел РФ;ru;2;19 июля;0;День_юридической_службы_министерства_внутренних_дел_Российской_Федерации
340;;1907;День рождения В.В.Маяковского;ru;3;19 июля;0;Маяковский,_Владимир_Владимирович
341;;2007;Международный день шахмат;ru;1;20 июля;0;Международный_день_шахмат
342;;2007;День Перуна;ru;2;20 июля;0;Перун
343;1973;2007;Скончался  Брюс Ли;ru;3;20 июля;0;Ли,_Брюс
344;1969;2107;Человек впервые ступил на Луну (Нил Армстронг);ru;1;21 июля;0;Армстронг,_Нил
345;1951;2207;День рождения Олега Газманова;ru;1;22 июля;0;Газманов,_Олег_Михайлович
346;1966;2207;День рождения Ивана Охлобыстина;ru;2;22 июля;0;Охлобыстин,_Иван_Иванович
347;;2307;Всемирный день китов и дельфинов;ru;1;23 июля;0;Всемирный_день_китов_и_дельфинов
348;;2407;День  рождения писателя А.Дюма (отец);ru;1;24 июля;0;Дюма,_Александр_(отец)
349;;2507;Скончался Владимир Высокций;ru;1;25 июля;0;Высоцкий,_Владимир_Семёнович
350;;2507;День Работника Торговли;ru;1;25 июля;0;День_работников_торговли,_бытового_обслуживания_населения_и_жилищно-коммунального_хозяйства
351;;2507;День сотрудника органов следствия РФ;ru;2;25 июля;0;День_сотрудника_органов_следствия_Российской_Федерации
352;;2507;Всемирный день улыбки;ru;3;25 июля;0;Всемирный_день_улыбки
353;;2607;День военно-морского флота;ru;1;26 июля;0;День_Военно-Морского_Флота
354;;2607;День парашютиста;ru;2;26 июля;0;День_парашютиста
355;1928;2607;День рождения кинорежисера Стенли Кубрика;ru;3;26 июля;0;Кубрик,_Стэнли
356;;2707;День  рождения гамбургера;ru;1;27 июля;0;Гамбургер
357;;2807;День крещения Руси;ru;1;28 июля;0;День_крещения_Руси
358;;2807;День PR - Специалиста;ru;2;28 июля;0;Политтехнолог
359;;2907;Международный день тигра;ru;1;29 июля;0;Международный_день_тигра
360;;2907;День рождения Игоря Крутого;ru;2;29 июля;0;Крутой,_Игорь_Яковлевич
361;;3007;Межународный день дружбы;ru;1;30 июля;0;Международный_день_ООН
362;;3107;День системного администратора;ru;1;31 июля;0;День_системного_администратора
363;;3107;День рождения актера Луи Де Фюнеса;ru;2;31 июля;0;Фюнес,_Луи_де
364;;108;День Тыла Вооруженных Сил РФ;ru;1;1 августа;0;День_тыла_вооружённых_сил_Российской_Федерации
365;;108;День памяти жертв I Мировой Войны;ru;2;1 августа;0;День_памяти_жертв_Первой_мировой_войны
366;;108;День рождения модельера Ив Сен-Лорана;ru;3;1 августа;0;Сен-Лоран,_Ив
367;;208;День Воздушно-Десантных Войск (День Десантника);ru;1;2 августа;0;День_Воздушно-десантных_войск
368;;208;День Железнодорожника;ru;2;2 августа;0;День_железнодорожника
369;;208;Ильин день - православный праздник;ru;3;2 августа;0;Ильин_день
370;;308;Скончался актер И.М. Смоктуновский;ru;1;3 августа;0;Смоктуновский,_Иннокентий_Михайлович
371;;408;День рождения музыканта Луи Армстронга;ru;1;4 августа;0;Армстронг,_Луи
372;;508;Скончалась Мэрилин Монро;ru;1;5 августа;0;Мэрилин_Монро
373;;608;День Железнодорожных Войск;ru;1;6 августа;0;День_железнодорожных_войск
374;1960;708;День  рождения актура Девида Духовны;ru;1;7 августа;0;Духовны,_Дэвид
375;1975;708;День рождения актрисы Шарли Терон;ru;2;7 августа;0;Терон,_Шарлиз
376;1947;708;День рождения певицы Софии Ротару;ru;3;7 августа;0;Ротару,_София_Михайловна
377;;808;День физкультурника;ru;1;8 августа;0;День_физкультурника
